{
  "name": "ea",
  "id": null,
  "identificationNumber": "ex nisi occaecat",
  "partyIdentificationType": "ipsum",
  "auditInfo": {
    "isDeleted": null,
    "createdBy": "dolore et ea elit",
    "updatedBy": "sit id occaecat officia consectetur",
    "updatedDate": null,
    "createdDate": "1950-05-15T15:21:51.573Z"
  },
  "issuedAtLocation": "incididunt qui proident anim",
  "issuedByAuthority": "culpa in Duis ut officia"
}
